{"captured_at":"2026-10-05T12:01:01.000Z","execution_manifest_sha256":"e74ab218bef3d5c57e6cc21108b96ababcc200448df75d7d62acc9751a9b655f","messages":[{"approximate_first_receive_timestamp":"2026-10-05T12:00:59.500Z","approximate_receive_count":3,"body":"{\"refund_request_id\":\"refund-request-0001\"}","body_sha256":"b0d0c77d28e7e21ab77ed65560863d9f9fe8258856447d0a020b96ba4eddd212","md5_of_body":"fedcba9876543210fedcba9876543210","message_deduplication_id":"dedup-0001","message_group_id":"group-0001","message_id":"message-0002","sent_timestamp":"2026-10-05T12:00:59.000Z","sequence_number":"18889000000000000002"}],"queue_name":"rua-run-0100-dlq.fifo","receive_complete":true,"record_type":"dlq_snapshot","run_id":"00000000-0000-4000-8000-000000000100","schema_version":1,"trial_id":"00000000-0000-4000-8000-000000000103","trial_manifest_sha256":"9d1b59c5a9eed2d2ca00ec23236dfe5c0a059a899b719c9d7ad81b3d6391cee0"}
